{
  "schema_version": "1.0",
  "run_id": "W118-blind-03-evaluation",
  "supersedes_run_id": null,
  "mode": "synthetic",
  "scenario": "fragmented",
  "variant": "fact-level-prior-exposure-rerun",
  "recorded_at": "2026-10-08T00:01:57.031425+00:00",
  "week": {
    "start": "2026-10-05",
    "end": "2026-10-09",
    "cutoff": "2026-10-09T08:00:00-05:00",
    "timezone": "America/Chicago"
  },
  "versions": {
    "repository_commit": "c0ef0fcf01d913661bf135d571c1ea723250deb2",
    "v2_spec": "ADB-V2-SELECT-1.0",
    "daily_prompt": "docs/automation-prompts/austin-daily-briefing.md@c0ef0fcf01d913661bf135d571c1ea723250deb2 (revision reference only; not independently read)",
    "friday_spec": "ADB-FRI-SYNTH-1.0",
    "rubric": "ADB-FRI-VALIDATE-1.0"
  },
  "inputs": {
    "weekly_packet": {
      "path": "docs/friday-evidence/2026-10-04/W118/packet.json",
      "sha256": "cca2e8390f8dc6086e87bb1bc33834a4dd421243ba95f26e6261c9bf9692d243"
    },
    "daily_v2_outputs": [
      {
        "path": "docs/friday-evidence/2026-10-04/W118/daily-v2.json",
        "sha256": "b069a846bcb24b4819e154eca5c187fddd95e141fa8d941db5fa837048a5067c"
      }
    ],
    "history_seed": {
      "path": "docs/friday-evidence/2026-10-04/W118/history.json",
      "sha256": "5fb14847c802199f93fb387e9171fd12401f4e7274c07f37a08f5efe0079fdee"
    },
    "synthesis_prompt": {
      "path": "docs/friday-evidence/2026-10-04/synthesis-instructions-v2.txt",
      "sha256": "39b46d5eb76135d83de9faed602ad419dabb63adaa9915784e7ba45a3f539e7f"
    },
    "reviewer_key": {
      "path": "docs/friday-evidence/2026-10-04/W118/reviewer-key.json",
      "sha256": "66b2b9849683b5d9350861a2d018abed6e5e4edb9b78809cbd5b7c546fad19db"
    }
  },
  "separation": {
    "constructor": "W118 fixture constructor; exact operator identity is not established by the authorized inputs",
    "synthesizer": "/root/blind_fragmented_rerun",
    "evaluator": "/root/evaluate_fragmented_rerun",
    "method": "Separate evaluator task context reviewed only pinned product spec/rubric, current evidence schema, W118 packet/sources/daily-v2/history/reviewer key, synthesis-instructions-v2.txt and the frozen W118-blind-03 output. Did not read other recap/evaluation/probe/challenge content or contact writers. Synthesizer metadata reports only the three authorized synthesis inputs; evaluator read the key only after output existed. This is role/context separation within the same model family, not independent human review.",
    "key_withheld": true,
    "limitations": [
      "Synthesizer key withholding and file-read isolation are documented by its execution metadata, not independently audited platform telemetry.",
      "Constructor identity and complete constructor execution history are not established in this restricted review.",
      "Evaluator saw filename listings while locating authorized inputs, but read no prohibited content."
    ]
  },
  "output": {
    "section_included": true,
    "omission_reason": null,
    "opening": "",
    "arcs": [
      {
        "arc_id": "A1",
        "heading": "Bus routes return in stages",
        "text": "Three of the four bus routes placed on detour at the start of the week are back on their normal paths by Friday’s cutoff. A maintenance closure began the disruption; partial corridor reopening restored two routes, and a third subsequently returned. That leaves one route on detour with no return date set. The week brought substantial restoration of normal routing, but the disruption has not fully ended."
      },
      {
        "arc_id": "A2",
        "heading": "A patient transfer plan takes shape",
        "text": "The clinic’s planned closure after its lease ends this month now comes with a signed agreement to transfer existing patients to two partners. The agreement gives the closure a defined transfer plan, while leaving appointment timing unsettled: current appointment dates are not guaranteed. A transfer agreement is in place; that does not establish that patients have already transferred or that their schedules will be preserved."
      },
      {
        "arc_id": "A3",
        "heading": "Water notice ends within a limited scope",
        "text": "The facility-specific boil-water notice issued after filter damage ended this week following repairs and compliant samples. The change is concrete: the notice that applied during repairs and testing has been lifted. Its scope matters as much as its resolution. The clearance applies to this facility; other infrastructure was not evaluated, so the result provides no basis for a broader claim about infrastructure conditions."
      }
    ],
    "exact_recap": "THIS WEEK IN AUSTIN\n\nBus routes return in stages\nThree of the four bus routes placed on detour at the start of the week are back on their normal paths by Friday’s cutoff. A maintenance closure began the disruption; partial corridor reopening restored two routes, and a third subsequently returned. That leaves one route on detour with no return date set. The week brought substantial restoration of normal routing, but the disruption has not fully ended.\nSources: Synthetic bus disruption notice; Synthetic bus access bulletin; Synthetic bus operations update.\n\nA patient transfer plan takes shape\nThe clinic’s planned closure after its lease ends this month now comes with a signed agreement to transfer existing patients to two partners. The agreement gives the closure a defined transfer plan, while leaving appointment timing unsettled: current appointment dates are not guaranteed. A transfer agreement is in place; that does not establish that patients have already transferred or that their schedules will be preserved.\nSources: Synthetic clinic notice; Synthetic clinic transition agreement.\n\nWater notice ends within a limited scope\nThe facility-specific boil-water notice issued after filter damage ended this week following repairs and compliant samples. The change is concrete: the notice that applied during repairs and testing has been lifted. Its scope matters as much as its resolution. The clearance applies to this facility; other infrastructure was not evaluated, so the result provides no basis for a broader claim about infrastructure conditions.\nSources: Synthetic waterworks inspection; Synthetic waterworks clearance.",
    "word_count": 245,
    "full_edition_word_count": null,
    "reading_time_method": "Recap whitespace-token count including section label, headings and source labels: 245; body prose: 195. At 200 words/minute, recap-only estimate is 1.225 minutes. Full-edition estimate unavailable because fixture contains shared editorial extracts only."
  },
  "sources": [
    {
      "source_id": "S01",
      "kind": "synthetic_packet",
      "publisher": "Synthetic bus disruption notice",
      "locator": "docs/friday-evidence/2026-10-04/W118/sources.json#S01",
      "publication_time": "2026-10-05T07:00:00-05:00",
      "access_time": "2026-10-08T00:01:57.031425+00:00",
      "access_status": "fixture_read",
      "supporting_note": "Fictional fixture only. Drivers are using detours on four bus routes because a maintenance project closes a corridor. Exact prior exposure is separately verified against the published C-item text, not inferred from source exposure.",
      "used_for": [
        "CL01",
        "CL02",
        "CL03",
        "CL05"
      ]
    },
    {
      "source_id": "S02",
      "kind": "synthetic_packet",
      "publisher": "Synthetic bus access bulletin",
      "locator": "docs/friday-evidence/2026-10-04/W118/sources.json#S02",
      "publication_time": "2026-10-07T07:00:00-05:00",
      "access_time": "2026-10-08T00:01:57.031425+00:00",
      "access_status": "fixture_read",
      "supporting_note": "Fictional fixture only. Two of the four routes return to normal paths after the north part of the corridor reopens. The other two routes remain on detour. Exact prior exposure is separately verified against the published C-item text, not inferred from source exposure.",
      "used_for": [
        "CL01",
        "CL02",
        "CL03",
        "CL05"
      ]
    },
    {
      "source_id": "S03",
      "kind": "synthetic_packet",
      "publisher": "Synthetic bus operations update",
      "locator": "docs/friday-evidence/2026-10-04/W118/sources.json#S03",
      "publication_time": "2026-10-09T07:00:00-05:00",
      "access_time": "2026-10-08T00:01:57.031425+00:00",
      "access_status": "fixture_read",
      "supporting_note": "Fictional fixture only. One more route returns to its normal path Thursday evening. One route remains on detour at Friday cutoff; its return date is not set. Exact prior exposure is separately verified against the published C-item text, not inferred from source exposure.",
      "used_for": [
        "CL01",
        "CL02",
        "CL03",
        "CL04",
        "CL05"
      ]
    },
    {
      "source_id": "S04",
      "kind": "synthetic_packet",
      "publisher": "Synthetic clinic notice",
      "locator": "docs/friday-evidence/2026-10-04/W118/sources.json#S04",
      "publication_time": "2026-10-06T07:00:00-05:00",
      "access_time": "2026-10-08T00:01:57.031425+00:00",
      "access_status": "fixture_read",
      "supporting_note": "Fictional fixture only. A community clinic announces it will close at the end of the month after its lease ends. Exact prior exposure is separately verified against the published C-item text, not inferred from source exposure.",
      "used_for": [
        "CL06",
        "CL07",
        "CL08"
      ]
    },
    {
      "source_id": "S05",
      "kind": "synthetic_packet",
      "publisher": "Synthetic clinic transition agreement",
      "locator": "docs/friday-evidence/2026-10-04/W118/sources.json#S05",
      "publication_time": "2026-10-08T07:00:00-05:00",
      "access_time": "2026-10-08T00:01:57.031425+00:00",
      "access_status": "fixture_read",